{
  "clients": {
    "ipify": {
      "address": "https://api.ipify.org",
      "timeout": 1
    }
  },
  "db": {
    "enabled": false,
    "main": {
      "conn_max_idle_count": 5,
      "conn_max_idle_time": 60,
      "conn_max_lifetime": 3600,
      "conn_max_open": 50,
      "dsn": "",
      "timeout_ping": 1
    },
    "read": {
      "conn_max_idle_count": 5,
      "conn_max_idle_time": 60,
      "conn_max_lifetime": 3600,
      "conn_max_open": 50,
      "dsn": "",
      "timeout_ping": 1
    }
  },
  "enabled": true,
  "log": {
    "address": "",
    "format": "JSON",
    "level": "INFO",
    "network": ""
  },
  "remoteConfigEndpoint": "",
  "remoteConfigPath": "",
  "remoteConfigProvider": "",
  "remoteConfigSecretKeyring": "",
  "servers": {
    "monitoring": {
      "address": ":8071",
      "timeout": 60
    },
    "private": {
      "address": ":8072",
      "timeout": 60
    },
    "public": {
      "address": ":8073",
      "timeout": 60
    }
  },
  "shutdown_timeout": 60
}
